{
  "citation_id": "cite-python-basics-001",
  "used_at": "2026-06-18T00:00:00Z",
  "phase": "research",
  "notebook_id": "notebook-1",
  "source_id": "source-1",
  "source_title": "Python Tutorial",
  "url": "https://docs.python.org/3/tutorial/",
  "claim_supported": "Official tutorial is useful for Python basics.",
  "locator": {
    "page": null,
    "section": "The Python Tutorial",
    "timestamp": null
  },
  "confidence": "medium"
}
